{"schemaVersion":"data.harness/v1","mappingId":"map-1","conceptId":"service.error-code","target":{"sourceId":"erp","assetId":"orders","fieldPath":"error_code"},"confidence":0.95,"schemaDigest":"sha256:aaaaaaaaaaaaaaaaaaaaaaaaaaaaaaaaaaaaaaaaaaaaaaaaaaaaaaaaaaaaaaaa","status":"proposed","proposedAt":"2026-08-27T00:00:00Z","rationale":"schema and values agree","lineage":[{"sourceId":"erp","assetId":"orders","fieldPath":"error_code"}]}
